{
  "$schema": "http://json-schema.org/draft-07/schema#",
  "$id": "run.schema.json",
  "title": "Pipeline Run Metrics",
  "type": "object",
  "additionalProperties": false,
  "required": [
    "version",
    "started_at",
    "ended_at",
    "wall_time_ms",
    "rows",
    "input_bytes",
    "throughput_input_mb_s",
    "rss_peak_mb",
    "cpu_user_pct",
    "cpu_sys_pct",
    "errors",
    "stages"
  ],
  "properties": {
    "version": { "type": "string", "enum": ["1"] },
    "started_at": { "type": "string", "format": "date-time" },
    "ended_at": { "type": "string", "format": "date-time" },
    "wall_time_ms": { "type": "number", "minimum": 0 },
    "rows": { "type": "integer", "minimum": 0 },
    "input_bytes": { "type": "integer", "minimum": 0 },
    "throughput_input_mb_s": { "type": "number", "minimum": 0 },
    "rss_peak_mb": { "type": "number", "minimum": 0 },
    "cpu_user_pct": { "type": "number", "minimum": 0 },
    "cpu_sys_pct": { "type": "number", "minimum": 0 },
    "errors": { "type": "integer", "minimum": 0 },
    "cache_hit_pct": { "type": ["number", "null"], "minimum": 0, "maximum": 100 },
    "build": {
      "type": "object",
      "additionalProperties": false,
      "required": ["type", "flags"],
      "properties": {
        "type": { "type": "string" },
        "flags": { "type": "string" }
      }
    },
    "host": {
      "type": "object",
      "additionalProperties": false,
      "properties": {
        "os": { "type": "string" },
        "arch": { "type": "string" },
        "cpu_model": { "type": "string" }
      }
    },
    "stages": {
      "type": "array",
      "minItems": 1,
      "items": {
        "type": "object",
        "additionalProperties": false,
        "required": ["name", "calls"],
        "properties": {
          "name": { "type": "string" },
          "calls": { "type": "integer", "minimum": 0 },
          "p50_ms": { "type": "number", "minimum": 0 },
          "p95_ms": { "type": "number", "minimum": 0 },
          "bytes_in": { "type": ["integer", "null"], "minimum": 0 },
          "bytes_out": { "type": ["integer", "null"], "minimum": 0 },
          "rows_in": { "type": ["integer", "null"], "minimum": 0 },
          "rows_out": { "type": ["integer", "null"], "minimum": 0 }
        }
      }
    },
    "samples": {
      "description": "Optional time series for CPU/RSS/bytes.",
      "type": "array",
      "items": {
        "type": "object",
        "additionalProperties": false,
        "required": ["ts_ms"],
        "properties": {
          "ts_ms": { "type": "integer", "minimum": 0 },
          "rss_mb": { "type": "number", "minimum": 0 },
          "cpu_pct": { "type": "number", "minimum": 0 },
          "bytes_in": { "type": "integer", "minimum": 0 },
          "bytes_out": { "type": "integer", "minimum": 0 }
        }
      }
    }
  }
}
